19:05:32.902583 IP ethanUSB.54108 > afb83dd09526a6517.awsglobalaccelerator.com.https: Flags [P.], seq 3572348478:3572348524, ack 1356507370, win 501, options [nop,nop,TS val 1355543481 ecr 2507812379], length 46
19:05:32.945640 IP afb83dd09526a6517.awsglobalaccelerator.com.https > ethanUSB.54108: Flags [P.], seq 1:47, ack 46, win 1021, options [nop,nop,TS val 2507818217 ecr 1355543481], length 46
19:05:32.945687 IP ethanUSB.54108 > afb83dd09526a6517.awsglobalaccelerator.com.https: Flags [.], ack 47, win 501, options [nop,nop,TS val 1355543524 ecr 2507818217], length 0
19:05:33.382334 IP ethanUSB.60654 > 82.221.107.34.bc.googleusercontent.com.http: Flags [.], ack 2024594711, win 501, options [nop,nop,TS val 466600562 ecr 3873721506], length 0
19:05:33.394386 IP 82.221.107.34.bc.googleusercontent.com.http > ethanUSB.60654: Flags [.], ack 1, win 286, options [nop,nop,TS val 3873731746 ecr 466569912], length 0
19:05:33.610942 IP ethanUSB.54878 > _gateway.domain: 26501+ [1au] PTR? 29.139.71.35.in-addr.arpa. (54)
19:05:34.152938 IP ethanUSB.51754 > 162.159.136.234.https: Flags [P.], seq 1057589533:1057589577, ack 3268129648, win 501, length 44
19:05:34.176679 IP 162.159.136.234.https > ethanUSB.51754: Flags [.], ack 44, win 73, length 0
19:05:34.230674 IP 162.159.136.234.https > ethanUSB.51754: Flags [P.], seq 1:33, ack 44, win 73, length 32
19:05:34.230688 IP ethanUSB.51754 > 162.159.136.234.https: Flags [.], ack 33, win 501, length 0
19:05:34.406281 IP ethanUSB.60656 > 82.221.107.34.bc.googleusercontent.com.http: Flags [.], ack 2724033573, win 501, options [nop,nop,TS val 466601585 ecr 3021014435], length 0
19:05:34.421785 IP 82.221.107.34.bc.googleusercontent.com.http > ethanUSB.60656: Flags [.], ack 1, win 286, options [nop,nop,TS val 3021024673 ecr 466569931], length 0
19:05:35.335973 IP 162.159.136.234.https > ethanUSB.51754: Flags [P.], seq 33:82, ack 44, win 73, length 49
19:05:35.335992 IP ethanUSB.51754 > 162.159.136.234.https: Flags [.], ack 82, win 501, length 0
19:05:38.614731 IP ethanUSB.54878 > _gateway.domain: 26501+ [1au] PTR? 29.139.71.35.in-addr.arpa. (54)
19:05:38.632309 IP _gateway.domain > ethanUSB.54878: 26501 1/0/1 PTR afb83dd09526a6517.awsglobalaccelerator.com. (110)
19:05:38.633574 IP ethanUSB.47376 > _gateway.domain: 54272+ [1au] PTR? 39.23.18.10.in-addr.arpa. (53)
19:05:38.638465 IP _gateway.domain > ethanUSB.47376: 54272 NXDomain* 0/1/1 (120)
19:05:38.638682 IP ethanUSB.47376 > _gateway.domain: 54272+ PTR? 39.23.18.10.in-addr.arpa. (42)
19:05:38.640794 IP _gateway.domain > ethanUSB.47376: 54272 NXDomain* 0/1/0 (109)
19:05:38.642310 IP ethanUSB.46831 > _gateway.domain: 39882+ [1au] PTR? 82.221.107.34.in-addr.arpa. (55)
19:05:38.656449 IP _gateway.domain > ethanUSB.46831: 39882 1/0/1 PTR 82.221.107.34.bc.googleusercontent.com. (107)
19:05:38.657761 IP ethanUSB.36465 > _gateway.domain: 60947+ [1au] PTR? 33.23.18.10.in-addr.arpa. (53)
19:05:38.662321 IP _gateway.domain > ethanUSB.36465: 60947 NXDomain* 0/1/1 (120)
19:05:38.662547 IP ethanUSB.36465 > _gateway.domain: 60947+ PTR? 33.23.18.10.in-addr.arpa. (42)
19:05:38.664492 IP _gateway.domain > ethanUSB.36465: 60947 NXDomain* 0/1/0 (109)
19:05:38.665917 IP ethanUSB.57488 > _gateway.domain: 37827+ [1au] PTR? 234.136.159.162.in-addr.arpa. (57)
19:05:38.686445 IP _gateway.domain > ethanUSB.57488: 37827 NXDomain 0/1/1 (153)
19:05:38.686703 IP ethanUSB.57488 > _gateway.domain: 37827+ PTR? 234.136.159.162.in-addr.arpa. (46)
19:05:38.689636 IP _gateway.domain > ethanUSB.57488: 37827 NXDomain 0/1/0 (142)
19:05:39.432126 IP lb-140-82-113-25-iad.github.com.https > ethanUSB.49806: Flags [P.], seq 2694123553:2694123579, ack 1073695410, win 70, options [nop,nop,TS val 3256072398 ecr 33169850], length 26
19:05:39.432422 IP ethanUSB.49806 > lb-140-82-113-25-iad.github.com.https: Flags [P.], seq 1:31, ack 26, win 501, options [nop,nop,TS val 33229857 ecr 3256072398], length 30
19:05:39.468065 IP lb-140-82-113-25-iad.github.com.https > ethanUSB.49806: Flags [.], ack 31, win 70, options [nop,nop,TS val 3256072447 ecr 33229857], length 0
19:05:39.751081 IP ethanUSB.49609 > _gateway.domain: 14622+ [1au] PTR? 25.113.82.140.in-addr.arpa. (55)
19:05:39.784495 IP _gateway.domain > ethanUSB.49609: 14622 1/0/1 PTR lb-140-82-113-25-iad.github.com. (100)
19:05:39.903539 IP ethanUSB.49124 > dfw28s29-in-f3.1e100.net.https: Flags [P.], seq 929149449:929149488, ack 3074790946, win 501, options [nop,nop,TS val 3677061435 ecr 316227288], length 39
19:05:39.920010 IP dfw28s29-in-f3.1e100.net.https > ethanUSB.49124: Flags [.], ack 39, win 267, options [nop,nop,TS val 316285721 ecr 3677061435], length 0
19:05:39.920046 IP dfw28s29-in-f3.1e100.net.https > ethanUSB.49124: Flags [P.], seq 1:40, ack 39, win 267, options [nop,nop,TS val 316285721 ecr 3677061435], length 39
19:05:39.962345 IP ethanUSB.49124 > dfw28s29-in-f3.1e100.net.https: Flags [.], ack 40, win 501, options [nop,nop,TS val 3677061494 ecr 316285721], length 0
19:05:41.626828 IP ethanUSB.bootpc > _gateway.bootps: BOOTP/DHCP, Request from 18:1d:ea:49:90:f8 (oui Unknown), length 300
19:05:41.838263 IP 0.0.0.0 > igmp.mcast.net: igmp v3 report, 1 group record(s)
19:05:42.694279 IP 0.0.0.0 > igmp.mcast.net: igmp v3 report, 1 group record(s)
19:05:45.110499 IP 0.0.0.0.bootpc > 255.255.255.255.bootps: BOOTP/DHCP, Request from 18:1d:ea:49:90:f8 (oui Unknown), length 300
19:05:45.117650 IP _gateway > ethanUSB: ICMP echo request, id 49403, seq 0, length 28
19:05:46.190881 IP _gateway.bootps > ethanUSB.bootpc: BOOTP/DHCP, Reply, length 300
19:05:46.191378 IP 0.0.0.0.bootpc > 255.255.255.255.bootps: BOOTP/DHCP, Request from 18:1d:ea:49:90:f8 (oui Unknown), length 300
19:05:46.195150 IP _gateway.bootps > ethanUSB.bootpc: BOOTP/DHCP, Reply, length 300
19:05:46.234291 IP ethanUSB > igmp.mcast.net: igmp v3 report, 1 group record(s)
19:05:46.278257 ARP, Request who-has _gateway tell ethanUSB, length 28
19:05:46.281082 ARP, Reply _gateway is-at 00:0c:29:26:9b:e5 (oui Unknown), length 46
19:05:46.281088 IP ethanUSB.35798 > 93.186.120.34.bc.googleusercontent.com.https: Flags [P.], seq 2734392066:2734392102, ack 2791374847, win 501, options [nop,nop,TS val 2543525909 ecr 542870701], length 36
19:05:46.281098 IP ethanUSB.40102 > server-13-249-79-230.dfw53.r.cloudfront.net.https: Flags [P.], seq 17992290:17992326, ack 1620179652, win 5500, options [nop,nop,TS val 4253200240 ecr 3524583955], length 36
19:05:46.281100 IP ethanUSB.49302 > server-108-156-223-128.dfw56.r.cloudfront.net.https: Flags [P.], seq 1621098607:1621098643, ack 1309471035, win 10490, options [nop,nop,TS val 1721354382 ecr 2638630902], length 36
19:05:46.281102 IP ethanUSB.46400 > server-108-156-244-250.dfw56.r.cloudfront.net.https: Flags [P.], seq 906211020:906211056, ack 2920853622, win 501, options [nop,nop,TS val 1441561108 ecr 2772307900], length 36
19:05:46.281104 IP ethanUSB.36734 > dfw25s48-in-f14.1e100.net.https: Flags [P.], seq 146177371:146177407, ack 3301347978, win 501, options [nop,nop,TS val 3935729539 ecr 3690248887], length 36
19:05:46.293144 IP server-13-249-79-230.dfw53.r.cloudfront.net.https > ethanUSB.40102: Flags [.], ack 36, win 160, options [nop,nop,TS val 3524608314 ecr 4253200240], length 0
19:05:46.293169 IP ethanUSB.40102 > server-13-249-79-230.dfw53.r.cloudfront.net.https: Flags [P.], seq 36:39, ack 1, win 5500, options [nop,nop,TS val 4253200254 ecr 3524608314], length 3
19:05:46.293185 IP 93.186.120.34.bc.googleusercontent.com.https > ethanUSB.35798: Flags [.], ack 36, win 272, options [nop,nop,TS val 542914900 ecr 2543525909], length 0
19:05:46.293192 IP ethanUSB.35798 > 93.186.120.34.bc.googleusercontent.com.https: Flags [P.], seq 36:39, ack 1, win 501, options [nop,nop,TS val 2543525924 ecr 542914900], length 3
19:05:46.293197 IP server-108-156-223-128.dfw56.r.cloudfront.net.https > ethanUSB.49302: Flags [.], ack 36, win 319, options [nop,nop,TS val 2638655278 ecr 1721354382], length 0
19:05:46.293202 IP ethanUSB.49302 > server-108-156-223-128.dfw56.r.cloudfront.net.https: Flags [P.], seq 36:39, ack 1, win 10490, options [nop,nop,TS val 1721354396 ecr 2638655278], length 3
19:05:46.299049 IP dfw25s48-in-f14.1e100.net.https > ethanUSB.36734: Flags [.], ack 36, win 429, options [nop,nop,TS val 3690271272 ecr 3935729539], length 0
19:05:46.299068 IP ethanUSB.36734 > dfw25s48-in-f14.1e100.net.https: Flags [P.], seq 36:39, ack 1, win 501, options [nop,nop,TS val 3935729559 ecr 3690271272], length 3
19:05:46.305266 IP server-13-249-79-230.dfw53.r.cloudfront.net.https > ethanUSB.40102: Flags [.], ack 39, win 160, options [nop,nop,TS val 3524608327 ecr 4253200254], length 0
19:05:46.306581 IP 93.186.120.34.bc.googleusercontent.com.https > ethanUSB.35798: Flags [.], ack 39, win 272, options [nop,nop,TS val 542914913 ecr 2543525924], length 0
19:05:46.306589 IP server-108-156-223-128.dfw56.r.cloudfront.net.https > ethanUSB.49302: Flags [.], ack 39, win 319, options [nop,nop,TS val 2638655290 ecr 1721354396], length 0
19:05:46.306592 IP 93.186.120.34.bc.googleusercontent.com.https > ethanUSB.35798: Flags [P.], seq 1:40, ack 39, win 272, options [nop,nop,TS val 542914913 ecr 2543525924], length 39
19:05:46.306600 IP server-108-156-223-128.dfw56.r.cloudfront.net.https > ethanUSB.49302: Flags [P.], seq 1:40, ack 39, win 319, options [nop,nop,TS val 2638655291 ecr 1721354396], length 39
19:05:46.306607 IP ethanUSB.49302 > server-108-156-223-128.dfw56.r.cloudfront.net.https: Flags [.], ack 40, win 10490, options [nop,nop,TS val 1721354410 ecr 2638655291], length 0
19:05:46.307790 IP server-13-249-79-230.dfw53.r.cloudfront.net.https > ethanUSB.40102: Flags [P.], seq 1:40, ack 39, win 160, options [nop,nop,TS val 3524608329 ecr 4253200254], length 39
19:05:46.307800 IP ethanUSB.40102 > server-13-249-79-230.dfw53.r.cloudfront.net.https: Flags [.], ack 40, win 5500, options [nop,nop,TS val 4253200269 ecr 3524608329], length 0
19:05:46.310247 IP ethanUSB.51754 > 162.159.136.234.https: Flags [P.], seq 44:92, ack 82, win 501, length 48
19:05:46.313752 IP dfw25s48-in-f14.1e100.net.https > ethanUSB.36734: Flags [.], ack 39, win 429, options [nop,nop,TS val 3690271285 ecr 3935729559], length 0
19:05:46.313762 IP dfw25s48-in-f14.1e100.net.https > ethanUSB.36734: Flags [P.], seq 1:40, ack 39, win 429, options [nop,nop,TS val 3690271285 ecr 3935729559], length 39
19:05:46.313767 IP ethanUSB.36734 > dfw25s48-in-f14.1e100.net.https: Flags [.], ack 40, win 501, options [nop,nop,TS val 3935729574 ecr 3690271285], length 0
19:05:46.323398 IP ethanUSB.mdns > 224.0.0.251.mdns: 0 [10q] PTR (QM)? _nfs._tcp.local. PTR (QM)? _pgpkey-hkp._tcp.local. PTR (QM)? _ipp._tcp.local. PTR (QM)? _ipps._tcp.local. PTR (QM)? _ftp._tcp.local. PTR (QM)? _webdav._tcp.local. PTR (QM)? _webdavs._tcp.local. PTR (QM)? _sftp-ssh._tcp.local. PTR (QM)? _smb._tcp.local. PTR (QM)? _afpovertcp._tcp.local. (159)
19:05:46.325063 IP ethanUSB.45442 > vpn.utexas.edu.https: Flags [S], seq 22543559, win 64240, options [mss 1460,sackOK,TS val 3557176819 ecr 0,nop,wscale 7], length 0
19:05:46.332731 IP 162.159.136.234.https > ethanUSB.51754: Flags [.], ack 92, win 73, length 0
19:05:46.332752 IP ethanUSB.51754 > 162.159.136.234.https: Flags [P.], seq 92:120, ack 82, win 501, length 28
19:05:46.340034 IP server-108-156-244-250.dfw56.r.cloudfront.net.https > ethanUSB.46400: Flags [.], ack 36, win 269, options [nop,nop,TS val 2772332322 ecr 1441561108], length 0
19:05:46.340056 IP ethanUSB.46400 > server-108-156-244-250.dfw56.r.cloudfront.net.https: Flags [P.], seq 36:39, ack 1, win 501, options [nop,nop,TS val 1441561169 ecr 2772332322], length 3
19:05:46.342247 IP ethanUSB.58526 > 159.240.178.107.bc.googleusercontent.com.https: Flags [P.], seq 546283969:546284005, ack 2014566055, win 501, options [nop,nop,TS val 1880876604 ecr 1846588735], length 36
19:05:46.342262 IP ethanUSB.33984 > server-108-156-211-88.dfw56.r.cloudfront.net.https: Flags [P.], seq 4022257060:4022257096, ack 2362687883, win 501, options [nop,nop,TS val 2756153476 ecr 3563636587], length 36
19:05:46.346042 IP 162.159.136.234.https > ethanUSB.51754: Flags [.], ack 120, win 73, length 0
19:05:46.346052 IP vpn.utexas.edu.https > ethanUSB.45442: Flags [S.], seq 4065395881, ack 22543560, win 32768, options [mss 1366,nop,nop,TS val 1342431596 ecr 3557176819], length 0
19:05:46.346068 IP ethanUSB.45442 > vpn.utexas.edu.https: Flags [.], ack 1, win 64240, options [nop,nop,TS val 3557176840 ecr 1342431596], length 0
19:05:46.346324 IP ethanUSB.45442 > vpn.utexas.edu.https: Flags [P.], seq 1:518, ack 1, win 64240, options [nop,nop,TS val 3557176841 ecr 1342431596], length 517
19:05:46.353603 IP server-108-156-244-250.dfw56.r.cloudfront.net.https > ethanUSB.46400: Flags [.], ack 39, win 269, options [nop,nop,TS val 2772332335 ecr 1441561169], length 0
19:05:46.354277 IP ethanUSB.35798 > 93.186.120.34.bc.googleusercontent.com.https: Flags [.], ack 40, win 501, options [nop,nop,TS val 2543525986 ecr 542914913], length 0
19:05:46.354498 IP server-108-156-244-250.dfw56.r.cloudfront.net.https > ethanUSB.46400: Flags [P.], seq 1:40, ack 39, win 269, options [nop,nop,TS val 2772332336 ecr 1441561169], length 39
19:05:46.354506 IP ethanUSB.46400 > server-108-156-244-250.dfw56.r.cloudfront.net.https: Flags [.], ack 40, win 501, options [nop,nop,TS val 1441561184 ecr 2772332336], length 0
19:05:46.354516 IP server-108-156-211-88.dfw56.r.cloudfront.net.https > ethanUSB.33984: Flags [.], ack 36, win 294, options [nop,nop,TS val 3563661024 ecr 2756153476], length 0
19:05:46.354526 IP ethanUSB.33984 > server-108-156-211-88.dfw56.r.cloudfront.net.https: Flags [P.], seq 36:39, ack 1, win 501, options [nop,nop,TS val 2756153489 ecr 3563661024], length 3
19:05:46.354530 IP 159.240.178.107.bc.googleusercontent.com.https > ethanUSB.58526: Flags [.], ack 36, win 364, options [nop,nop,TS val 1846610652 ecr 1880876604], length 0
19:05:46.354534 IP ethanUSB.58526 > 159.240.178.107.bc.googleusercontent.com.https: Flags [P.], seq 36:39, ack 1, win 501, options [nop,nop,TS val 1880876617 ecr 1846610652], length 3
19:05:46.365458 IP vpn.utexas.edu.https > ethanUSB.45442: Flags [.], ack 518, win 32768, options [nop,nop,TS val 1342431613 ecr 3557176841], length 0
19:05:46.365471 IP vpn.utexas.edu.https > ethanUSB.45442: Flags [P.], seq 1:1355, ack 518, win 32768, options [nop,nop,TS val 1342431613 ecr 0], length 1354
19:05:46.365478 IP ethanUSB.45442 > vpn.utexas.edu.https: Flags [.], ack 1355, win 63638, options [nop,nop,TS val 3557176860 ecr 1342431613], length 0
19:05:46.369523 IP server-108-156-211-88.dfw56.r.cloudfront.net.https > ethanUSB.33984: Flags [.], ack 39, win 294, options [nop,nop,TS val 3563661037 ecr 2756153489], length 0
19:05:46.369529 IP 159.240.178.107.bc.googleusercontent.com.https > ethanUSB.58526: Flags [.], ack 39, win 364, options [nop,nop,TS val 1846610664 ecr 1880876617], length 0
19:05:46.369533 IP 159.240.178.107.bc.googleusercontent.com.https > ethanUSB.58526: Flags [P.], seq 1:40, ack 39, win 364, options [nop,nop,TS val 1846610664 ecr 1880876617], length 39
19:05:46.369537 IP ethanUSB.58526 > 159.240.178.107.bc.googleusercontent.com.https: Flags [.], ack 40, win 501, options [nop,nop,TS val 1880876632 ecr 1846610664], length 0
19:05:46.369548 IP server-108-156-211-88.dfw56.r.cloudfront.net.https > ethanUSB.33984: Flags [P.], seq 1:40, ack 39, win 294, options [nop,nop,TS val 3563661037 ecr 2756153489], length 39
19:05:46.369551 IP ethanUSB.33984 > server-108-156-211-88.dfw56.r.cloudfront.net.https: Flags [.], ack 40, win 501, options [nop,nop,TS val 2756153504 ecr 3563661037], length 0
19:05:46.377694 IP 162.159.136.234.https > ethanUSB.51754: Flags [P.], seq 82:115, ack 120, win 73, length 33
19:05:46.377701 IP ethanUSB.51754 > 162.159.136.234.https: Flags [.], ack 115, win 501, length 0
19:05:46.384239 IP vpn.utexas.edu.https > ethanUSB.45442: Flags [P.], seq 1355:2709, ack 518, win 32768, options [nop,nop,TS val 1342431633 ecr 0], length 1354
19:05:46.384256 IP ethanUSB.45442 > vpn.utexas.edu.https: Flags [.], ack 2709, win 62284, options [nop,nop,TS val 3557176878 ecr 1342431633], length 0
19:05:46.384267 IP vpn.utexas.edu.https > ethanUSB.45442: Flags [P.], seq 2709:4063, ack 518, win 32768, options [nop,nop,TS val 1342431633 ecr 0], length 1354
19:05:46.384271 IP ethanUSB.45442 > vpn.utexas.edu.https: Flags [.], ack 4063, win 60930, options [nop,nop,TS val 3557176879 ecr 1342431633], length 0
19:05:46.394225 IP 162.159.136.234.https > ethanUSB.51754: Flags [P.], seq 115:143, ack 120, win 73, length 28
19:05:46.394252 IP ethanUSB.51754 > 162.159.136.234.https: Flags [.], ack 143, win 501, length 0
19:05:46.401732 IP vpn.utexas.edu.https > ethanUSB.45442: Flags [P.], seq 4063:5417, ack 518, win 32768, options [nop,nop,TS val 1342431651 ecr 0], length 1354
19:05:46.401747 IP ethanUSB.45442 > vpn.utexas.edu.https: Flags [.], ack 5417, win 62284, options [nop,nop,TS val 3557176896 ecr 1342431651], length 0
19:05:46.401765 IP vpn.utexas.edu.https > ethanUSB.45442: Flags [P.], seq 5417:6327, ack 518, win 32768, options [nop,nop,TS val 1342431651 ecr 0], length 910
19:05:46.401767 IP ethanUSB.45442 > vpn.utexas.edu.https: Flags [.], ack 6327, win 61374, options [nop,nop,TS val 3557176896 ecr 1342431651], length 0
19:05:46.402693 IP ethanUSB.45442 > vpn.utexas.edu.https: Flags [P.], seq 518:644, ack 6327, win 63638, options [nop,nop,TS val 3557176897 ecr 1342431651], length 126
19:05:46.421276 IP vpn.utexas.edu.https > ethanUSB.45442: Flags [.], ack 644, win 32768, options [nop,nop,TS val 1342431670 ecr 3557176897], length 0
19:05:46.421288 IP vpn.utexas.edu.https > ethanUSB.45442: Flags [P.], seq 6327:6378, ack 644, win 32768, options [nop,nop,TS val 1342431671 ecr 0], length 51
19:05:46.421294 IP ethanUSB.45442 > vpn.utexas.edu.https: Flags [.], ack 6378, win 63638, options [nop,nop,TS val 3557176916 ecr 1342431671], length 0
19:05:46.421477 IP ethanUSB.45442 > vpn.utexas.edu.https: Flags [P.], seq 644:877, ack 6378, win 63638, options [nop,nop,TS val 3557176916 ecr 1342431671], length 233
19:05:46.439767 IP vpn.utexas.edu.https > ethanUSB.45442: Flags [.], ack 877, win 32768, options [nop,nop,TS val 1342431689 ecr 3557176916], length 0
19:05:46.439783 IP vpn.utexas.edu.https > ethanUSB.45442: Flags [P.], seq 6378:6993, ack 877, win 32768, options [nop,nop,TS val 1342431689 ecr 0], length 615
19:05:46.439792 IP ethanUSB.45442 > vpn.utexas.edu.https: Flags [.], ack 6993, win 63638, options [nop,nop,TS val 3557176934 ecr 1342431689], length 0
19:05:46.439816 IP vpn.utexas.edu.https > ethanUSB.45442: Flags [FP.], seq 6993, ack 877, win 32768, options [nop,nop,TS val 1342431689 ecr 0], length 0
19:05:46.470313 IP ethanUSB.59176 > server-108-138-159-14.dfw56.r.cloudfront.net.https: Flags [P.], seq 3143229788:3143229824, ack 2481069374, win 501, options [nop,nop,TS val 3178193305 ecr 2501635579], length 36
19:05:46.470348 IP ethanUSB.54108 > afb83dd09526a6517.awsglobalaccelerator.com.https: Flags [P.], seq 46:82, ack 47, win 501, options [nop,nop,TS val 1355557049 ecr 2507818217], length 36
19:05:46.482297 IP ethanUSB.45442 > vpn.utexas.edu.https: Flags [.], ack 6994, win 63638, options [nop,nop,TS val 3557176977 ecr 1342431689], length 0
19:05:46.506257 IP ethanUSB > igmp.mcast.net: igmp v3 report, 1 group record(s)
19:05:46.506308 IP ethanUSB.35792 > 93.186.120.34.bc.googleusercontent.com.https: Flags [P.], seq 2310780487:2310780519, ack 4016776565, win 501, options [nop,nop,TS val 2543526138 ecr 272452622], length 32
19:05:46.523266 IP ethanUSB.mdns > 224.0.0.251.mdns: 0 [3q] [4n] ANY (QM)? 4.c.b.9.d.3.9.4.b.5.e.e.c.b.a.f.0.0.0.0.0.0.0.0.0.0.0.0.0.8.e.f.ip6.arpa. ANY (QM)? ethanUSB.local. ANY (QM)? 39.23.18.10.in-addr.arpa. (208)
19:05:46.534249 IP ethanUSB.49806 > lb-140-82-113-25-iad.github.com.https: Flags [P.], seq 31:59, ack 26, win 501, options [nop,nop,TS val 33236958 ecr 3256072447], length 28
19:05:46.543976 IP server-108-138-159-14.dfw56.r.cloudfront.net.https > ethanUSB.59176: Flags [.], ack 36, win 265, options [nop,nop,TS val 2501660203 ecr 3178193305], length 0
19:05:46.543996 IP ethanUSB.59176 > server-108-138-159-14.dfw56.r.cloudfront.net.https: Flags [P.], seq 36:39, ack 1, win 501, options [nop,nop,TS val 3178193378 ecr 2501660203], length 3
19:05:46.544008 IP 93.186.120.34.bc.googleusercontent.com.https > ethanUSB.35792: Flags [.], ack 32, win 302, options [nop,nop,TS val 272470962 ecr 2543526138], length 0
19:05:46.558302 IP server-108-138-159-14.dfw56.r.cloudfront.net.https > ethanUSB.59176: Flags [.], ack 39, win 265, options [nop,nop,TS val 2501660216 ecr 3178193378], length 0
19:05:46.558308 IP server-108-138-159-14.dfw56.r.cloudfront.net.https > ethanUSB.59176: Flags [P.], seq 1:40, ack 39, win 265, options [nop,nop,TS val 2501660216 ecr 3178193378], length 39
19:05:46.558313 IP ethanUSB.59176 > server-108-138-159-14.dfw56.r.cloudfront.net.https: Flags [.], ack 40, win 501, options [nop,nop,TS val 3178193393 ecr 2501660216], length 0
19:05:46.567267 IP ethanUSB.45442 > vpn.utexas.edu.https: Flags [F.], seq 877, ack 6994, win 63638, options [nop,nop,TS val 3557177061 ecr 1342431689], length 0
19:05:46.569776 IP lb-140-82-113-25-iad.github.com.https > ethanUSB.49806: Flags [.], ack 59, win 70, options [nop,nop,TS val 3256079549 ecr 33236958], length 0
19:05:46.570438 IP lb-140-82-113-25-iad.github.com.https > ethanUSB.49806: Flags [P.], seq 26:50, ack 59, win 70, options [nop,nop,TS val 3256079550 ecr 33236958], length 24
19:05:46.570446 IP lb-140-82-113-25-iad.github.com.https > ethanUSB.49806: Flags [P.], seq 50:74, ack 59, win 70, options [nop,nop,TS val 3256079550 ecr 33236958], length 24
19:05:46.570447 IP lb-140-82-113-25-iad.github.com.https > ethanUSB.49806: Flags [F.], seq 74, ack 59, win 70, options [nop,nop,TS val 3256079550 ecr 33236958], length 0
19:05:46.570651 IP ethanUSB.49806 > lb-140-82-113-25-iad.github.com.https: Flags [P.], seq 59:83, ack 75, win 501, options [nop,nop,TS val 33236995 ecr 3256079550], length 24
19:05:46.570674 IP ethanUSB.49806 > lb-140-82-113-25-iad.github.com.https: Flags [F.], seq 83, ack 75, win 501, options [nop,nop,TS val 33236995 ecr 3256079550], length 0
19:05:46.578383 IP afb83dd09526a6517.awsglobalaccelerator.com.https > ethanUSB.54108: Flags [.], ack 82, win 1021, options [nop,nop,TS val 2507819581 ecr 1355557049], length 0
19:05:46.578404 IP ethanUSB.54108 > afb83dd09526a6517.awsglobalaccelerator.com.https: Flags [P.], seq 82:92, ack 47, win 501, options [nop,nop,TS val 1355557157 ecr 2507819581], length 10
19:05:46.581714 IP 93.186.120.34.bc.googleusercontent.com.https > ethanUSB.35792: Flags [P.], seq 1:26, ack 32, win 302, options [nop,nop,TS val 272470999 ecr 2543526138], length 25
19:05:46.584111 IP vpn.utexas.edu.https > ethanUSB.45442: Flags [.], ack 878, win 32768, options [nop,nop,TS val 1342431833 ecr 0], length 0
19:05:46.587405 IP afb83dd09526a6517.awsglobalaccelerator.com.https > ethanUSB.54108: Flags [.], ack 92, win 1021, options [nop,nop,TS val 2507819581 ecr 1355557157], length 0
19:05:46.606560 IP lb-140-82-113-25-iad.github.com.https > ethanUSB.49806: Flags [R], seq 2694123628, win 0, length 0
19:05:46.606579 IP lb-140-82-113-25-iad.github.com.https > ethanUSB.49806: Flags [R], seq 2694123628, win 0, length 0
19:05:46.618318 IP afb83dd09526a6517.awsglobalaccelerator.com.https > ethanUSB.54108: Flags [P.], seq 47:93, ack 92, win 1021, options [nop,nop,TS val 2507819584 ecr 1355557157], length 46
19:05:46.618336 IP ethanUSB.54108 > afb83dd09526a6517.awsglobalaccelerator.com.https: Flags [.], ack 93, win 501, options [nop,nop,TS val 1355557197 ecr 2507819584], length 0
19:05:46.622441 IP ethanUSB.35792 > 93.186.120.34.bc.googleusercontent.com.https: Flags [.], ack 26, win 501, options [nop,nop,TS val 2543526254 ecr 272470999], length 0
19:05:46.694337 IP ethanUSB.60654 > 82.221.107.34.bc.googleusercontent.com.http: Flags [.], ack 1, win 501, options [nop,nop,TS val 466613874 ecr 3873731746], length 0
19:05:46.708508 IP 82.221.107.34.bc.googleusercontent.com.http > ethanUSB.60654: Flags [.], ack 1, win 286, options [nop,nop,TS val 3873745059 ecr 466569912], length 0
19:05:46.773704 IP ethanUSB.mdns > 224.0.0.251.mdns: 0 [3q] [4n] ANY (QM)? 4.c.b.9.d.3.9.4.b.5.e.e.c.b.a.f.0.0.0.0.0.0.0.0.0.0.0.0.0.8.e.f.ip6.arpa. ANY (QM)? ethanUSB.local. ANY (QM)? 39.23.18.10.in-addr.arpa. (208)
19:05:46.834562 IP ethanUSB.46670 > _gateway.domain: 10651+ [1au] AAAA? daisy.ubuntu.com. (45)
19:05:46.838683 IP _gateway.domain > ethanUSB.46670: 10651 0/1/1 (109)
19:05:46.839736 IP ethanUSB.60064 > _gateway.domain: 58882+ [1au] A? daisy.ubuntu.com. (45)
19:05:46.839796 IP ethanUSB.36110 > _gateway.domain: 61796+ [1au] AAAA? daisy.ubuntu.com. (45)
19:05:46.842618 IP _gateway.domain > ethanUSB.36110: 61796 0/1/1 (109)
19:05:46.854267 IP ethanUSB.44634 > stackoverflow.com.https: Flags [P.], seq 2371899877:2371899913, ack 3900523555, win 501, options [nop,nop,TS val 3022123198 ecr 3576629704], length 36

